<?xml version="1.0" encoding="UTF-8"?>
<pedidos xmlns:xsi = "http://www.w3.org/2001/XMLSchema-instance" xsi:noNamespaceSchemaLocation = "pedido.xsd" >
      <sucursal codigo="A0b00R01">
            <direccion>C/Castilla, 1</direccion>
            <direccion>C/Castilla, 1</direccion>
            <trabajador>Steve Jobs</trabajador>
            <fecha>2012-01-12</fecha>
            <observacion>Urgente</observacion>
            <articulo codigo="AAA-111">
                  <unidades>12</unidades>
                  <precio>100</precio>
                  <observaciones>Producto muy frágil</observaciones>
                  <plazo>10</plazo>
            </articulo>

            <articulo codigo="AAA-112">
                  <unidades>10</unidades>
                  <precio>10</precio>
                  <observaciones>No apilar más de cinco paquetes</observaciones>
                  <plazo>8</plazo>
            </articulo>
      </sucursal>

      <sucursal codigo="B0000002">
            <direccion>Avda. Gran Vía s/n</direccion>
            <trabajador>Bill Gates</trabajador>
            <fecha>2012-02-10</fecha>
            <articulo codigo="ABC-001">
                  <unidades>5</unidades>
                  <precio>50</precio>
                  <observaciones />
                  <plazo>3</plazo>
            </articulo>
      </sucursal>
</pedidos>